{
  "plan_model_version": "v1",
  "artifact_type": "iteration-plan",
  "authority_chain": ["docs/fake-arch.md"],
  "items": [
    {
      "item_id": "polish",
      "seq": 0,
      "depends_on": [],
      "dod_ref": "docs/fake-arch.md#polish-done",
      "title": "user-facing polish",
      "scope": "Implement user-facing polish across the skill's outputs. Definition of done: the feature is complete when it feels finished and users are happy with it. No objective acceptance criteria are defined and no measurable gate is specified.",
      "constraints_profile": "iteration-plan"
    }
  ]
}
