{
  "plan_model_version": "v1",
  "artifact_type": "iteration-plan",
  "authority_chain": ["proposal.md", "iteration-plan.md"],
  "conflict_rule": "on conflict, authority_chain[0] (proposal.md) wins",
  "items": [
    {
      "item_id": "CSR-I0",
      "seq": 0,
      "depends_on": [],
      "dod_ref": "iteration-plan.md#csr-i0",
      "title": "scaffold + SKILL.md + activation/scope-guard",
      "scope": "Loadable skill skeleton; Scope Guard routes code->parallel-development / spec-authoring->blueprint-crafting; Q4 explicit-invocation noted (3-way trigger_check deferred).",
      "source_location": "proposal.md §2, §6, §9 Q4",
      "complexity": "M",
      "risk": "activation collision with bc/pd on review-type requests; mitigated by Q4 explicit-invocation + Scope Guard.",
      "odp_status": [],
      "constraints_profile": "iteration-plan",
      "parallel_group": null,
      "blueprint_subset": []
    },
    {
      "item_id": "CSR-I1",
      "seq": 1,
      "depends_on": ["CSR-I0"],
      "dod_ref": "iteration-plan.md#csr-i1",
      "title": "schemas: doc-findings + convergence-record",
      "scope": "doc-findings.schema.json (generalize bc review-findings; v1 kind enum = 6 Q2 kinds; severity keeps bc {blocker,warning,coverage} - coverage is honest-disclosure, distinct from coverage-gap KIND) + convergence-record.schema.json (fields name-aligned to loop_state run-record; no code dep).",
      "source_location": "proposal.md §9 Q2, Q3",
      "complexity": "M",
      "risk": "doc-findings kind enum drifts from bc review-findings; mitigated by Q2 lock + documented mapping (FX-04).",
      "odp_status": [],
      "constraints_profile": "iteration-plan",
      "parallel_group": null,
      "blueprint_subset": []
    },
    {
      "item_id": "CSR-I2",
      "seq": 2,
      "depends_on": ["CSR-I1"],
      "dod_ref": "iteration-plan.md#csr-i2",
      "title": "same-source leg: skill-local doc-reviewer agent",
      "scope": "Fresh-context, read-only, outcome-axis-barred doc-reviewer agent returning doc-findings shape; NOT plan-reviewer (plan-model-shaped).",
      "source_location": "proposal.md §3, §9 Q5; FX-05",
      "complexity": "M",
      "risk": "wrongly reusing plan-reviewer as the leg; mitigated by Q5/FX-05 (skill-local reviewer).",
      "odp_status": [],
      "constraints_profile": "iteration-plan",
      "parallel_group": "legs",
      "blueprint_subset": []
    },
    {
      "item_id": "CSR-I3",
      "seq": 3,
      "depends_on": ["CSR-I1"],
      "dod_ref": "iteration-plan.md#csr-i3",
      "title": "heterogeneous substrate: copy-pattern hetero_review.py, doc-adapted",
      "scope": "Copy-pattern pd hetero_review.py (FLAG-SURFACE MANIFEST, token-injection, fence-aware parse, substrate-error DEGRADE, multi-provider merge) with a DOC prompt + doc-findings schema; no --diff/--blueprint hard-require. Preserve function-signature contract + divergence log.",
      "source_location": "proposal.md §3, §5, §8; hetero_review.py is the pattern source",
      "complexity": "L",
      "risk": "copy silently drifts from hetero_review.py, breaking Phase-B B1/B3; mitigated by §5 interface-compat constraint (signature contract + divergence log, F3).",
      "odp_status": [],
      "constraints_profile": "iteration-plan",
      "parallel_group": "legs",
      "blueprint_subset": []
    },
    {
      "item_id": "CSR-I4",
      "seq": 4,
      "depends_on": ["CSR-I2", "CSR-I3"],
      "dod_ref": "iteration-plan.md#csr-i4",
      "title": "convergence loop driver",
      "scope": "Orchestrate 同源<->异源 multi-round debate: caps by artifact size (short=2/long=5-7), substantive-convergence BOTH prongs (no-new-Blocker AND core-claims-coverage; not zero-finding), per-round reconciliation table, cap->human, adversarial-stalemate, don't-blind-trust-either; OWNS the proposal §3 pluggable-seam (findings-schema as parameter + 同源-leg as callback); emit convergence-record.",
      "source_location": "proposal.md §3 (policy + reconciliation table)",
      "complexity": "L",
      "risk": "chasing zero-finding (infinite loop on docs); mitigated by substantive-convergence doctrine + caps (this proposal's own loop validated it).",
      "odp_status": [],
      "constraints_profile": "iteration-plan",
      "parallel_group": null,
      "blueprint_subset": []
    },
    {
      "item_id": "CSR-I5",
      "seq": 5,
      "depends_on": ["CSR-I4"],
      "dod_ref": "iteration-plan.md#csr-i5",
      "title": "self-gates (Q6) + standard set",
      "scope": "Three skill-specific gates (dogfood own loop on own SKILL.md - SKIPS gracefully w/o API tokens, recorded log substitutes; findings shape-contract mirror adapter_shape_check; offline convergence-policy mirror hetero_review_wiring + core-claims-coverage fixture) PLUS standard (disconnect_check/plugin_layout/lint_self).",
      "source_location": "proposal.md §9 Q6",
      "complexity": "L",
      "risk": "leg emit path produces malformed findings; mitigated by findings shape-contract gate.",
      "odp_status": [],
      "constraints_profile": "iteration-plan",
      "parallel_group": null,
      "blueprint_subset": []
    },
    {
      "item_id": "CSR-I6",
      "seq": 6,
      "depends_on": ["CSR-I5"],
      "dod_ref": "iteration-plan.md#csr-i6",
      "title": "dogfood + 质量稳定 gate (Q7)",
      "scope": "Run the skill on N>=3 real docs (>=1 long-doc cap=5-7 + own SKILL.md as one of the N); record a measured convergence profile.",
      "source_location": "proposal.md §5, §9 Q7",
      "complexity": "L",
      "risk": "dogfood N too small to validate long-doc convergence; mitigated by Q7 (>=1 long-doc required).",
      "odp_status": [],
      "constraints_profile": "iteration-plan",
      "parallel_group": null,
      "blueprint_subset": []
    }
  ],
  "anchors": {
    "complexity-tiers": {"present": true, "ref": "iteration-plan.md#1-estimation-gauge"},
    "dependency-edges": {"present": true, "ref": "iteration-plan.md#2-overview"},
    "per-iteration-dod": {"present": true, "ref": "iteration-plan.md#3-csr-i0csr-i1"},
    "dag": {"present": true, "ref": "iteration-plan.md#7-dependencies-and-parallelism-dag"},
    "phase-acceptance-gates": {"present": true, "ref": "iteration-plan.md#6-phase-a-acceptance-gate"},
    "risks-mitigations": {"present": true, "ref": "iteration-plan.md#8-risks-and-mitigations"},
    "out-of-scope": {"present": true, "ref": "iteration-plan.md#9-out-of-scope-phase-a"},
    "cross-cutting-tasks": {"present": true, "ref": "iteration-plan.md#10-cross-cutting-tasks"}
  },
  "anchors_meta": {"source": "author-supplied"},
  "subset_tags": {
    "executable": ["item_id", "seq", "depends_on", "dod_ref"],
    "upstream_only": ["title", "scope", "source_location", "complexity", "risk", "odp_status", "constraints_profile", "parallel_group"],
    "downstream_only": ["blueprint_subset"]
  }
}
